{
  "$schema": "http://json-schema.org/draft-04/schema#",
  "id": "http://moj.gov.uk/cps/prosecutioncasefile/domain/event/public.prosecutioncasefile.document-review-required",
  "type": "object",
  "properties": {
    "fileStoreId": {
      "$ref": "http://cpp.moj.gov.uk/core/domain/json/schema/data-types.json#/definitions/uuid"
    },
    "receivedDateTime":{
      "$ref": "http://cpp.moj.gov.uk/core/domain/json/schema/data-types.json#/definitions/date-time"
    },
    "cmsDocumentId": {
      "type": "string"
    },
    "source": {
      "type": "string"
    },
    "prosecutingAuthority": {
      "type": "string"
    },
    "caseId": {
      "$ref": "http://cpp.moj.gov.uk/core/domain/json/schema/data-types.json#/definitions/uuid"
    },
    "documentType": {
      "type": "string",
      "enum": [
        "APPLICATION",
        "CORRESPONDENCE",
        "PLEA",
        "OTHER"
      ]
    },
    "errorCodes": {
      "type": "array",
      "items": {
        "type": "string"
      }
    }
  },
  "required": [
    "fileStoreId"
  ],
  "additionalProperties": true
}