{
  "fileStoreId": "${fileStoreId}",
  "receivedDateTime": "2020-01-20T13:50:00Z",
  "cmsDocumentId": "45b0c3fe-afe6-4652-882f-7882d79eadd9",
  "source": 	"CPS",
  "documentType": "OTHER",
  "caseId": "45b0c3fe-afe6-4652-882f-7882d79eadd9",
  "errorCodes": [
    "reasonCode1",
    "reasonCode2"
  ]
}